{
  "$schema": "https://raw.githubusercontent.com/tonytins/citylimits/main/docs/schemas/scenario.v2.0.schema.json",
  "format": "2.0",
  "name": "Rail",
  "description": "Rail crosses a straight road and a power line, serves a zone along its edge, and tunnels under a lake from one bank; water with no rail beside it can't be tunnelled.",
  "seed": 2000,
  "ends": "1900-01",
  "actions": [
    { "at": "1900-01", "tool": "Road", "from": { "x": 30, "y": 57 }, "to": { "x": 30, "y": 63 }, "expect": "Built" },
    { "at": "1900-01", "tool": "PowerLine", "from": { "x": 40, "y": 57 }, "to": { "x": 40, "y": 63 }, "expect": "Built" },
    { "at": "1900-01", "tool": "Rail", "from": { "x": 28, "y": 60 }, "to": { "x": 45, "y": 60 }, "expect": "Built" },
    { "at": "1900-01", "tool": "ZoneResidential", "from": { "x": 34, "y": 58 }, "expect": "Built" },
    { "at": "1900-01", "tool": "Rail", "from": { "x": 55, "y": 51 }, "to": { "x": 70, "y": 51 }, "expect": "Built" },
    { "at": "1900-01", "tool": "Rail", "from": { "x": 62, "y": 48 }, "expect": "Refused:CannotBuildHere" }
  ],
  "checks": [
    { "at": "1900-01", "tile": { "x": 30, "y": 60 }, "kind": "Grass", "use": "RailAcrossRoad" },
    { "at": "1900-01", "tile": { "x": 40, "y": 60 }, "kind": "Grass", "use": "RailAcrossPowerLine" },
    { "at": "1900-01", "tile": { "x": 33, "y": 60 }, "kind": "Grass", "use": "Rail" },
    { "at": "1900-01", "tile": { "x": 62, "y": 51 }, "kind": "Water", "use": "Rail" },
    { "at": "1900-01", "tile": { "x": 62, "y": 48 }, "kind": "Water", "use": "None" },
    { "at": "1900-01", "tile": { "x": 34, "y": 58 }, "served": true },
    { "at": "1900-01", "count": "Rail", "equals": 34 },
    { "at": "1900-01", "count": "Road", "equals": 7 },
    { "at": "1900-01", "count": "PowerLine", "equals": 7 },
    { "at": "1900-01", "fundsEquals": 18131 }
  ]
}
